Keywords,Search Volume (Average),Search Volume (Dec 2023),Search Volume (Jan 2024),Search Volume (Feb 2024),Search Volume (Mar 2024),Search Volume (Apr 2024),Search Volume (May 2024),Search Volume (Jun 2024),Search Volume (Jul 2024),Search Volume (Aug 2024),Search Volume (Sep 2024),Search Volume (Oct 2024),Search Volume (Nov 2024),Trend,Average CPC (USD),Low Top Of Page Bid (USD),High Top Of Page Bid (USD),Competition
webselfstorage,9900,9900,12100,9900,12100,9900,12100,9900,9900,9900,9900,9900,8100,-18,11.22,3.61,14.00,3
mini storage software,3600,1300,1600,1600,1900,3600,2900,5400,9900,5400,3600,2900,2400,85,19.85,4.59,20.28,30
self storage computer software,3600,1300,1600,1600,1900,3600,2900,5400,9900,5400,3600,2900,2400,85,19.85,4.59,20.28,30
software for mini storage,3600,1300,1600,1600,1900,3600,2900,5400,9900,5400,3600,2900,2400,85,19.85,4.59,20.28,30
software for self storage,3600,1300,1600,1600,1900,3600,2900,5400,9900,5400,3600,2900,2400,85,19.85,4.59,20.28,30
software self storage,3600,1300,1600,1600,1900,3600,2900,5400,9900,5400,3600,2900,2400,85,19.85,4.59,20.28,30
storage facility software,3600,1300,1600,1600,1900,3600,2900,5400,9900,5400,3600,2900,2400,85,19.85,4.59,20.28,30
storage unit software,3600,1300,1600,1600,1900,3600,2900,5400,9900,5400,3600,2900,2400,85,19.85,4.59,20.28,30
webselfstorage facility login,2400,1900,2400,2400,2900,2400,2400,1900,1900,1900,1900,1900,2400,26,15.14,5.00,11.00,0
webselfstorage login,2400,1900,2400,2400,2900,2400,2400,1900,1900,1900,1900,1900,2400,26,15.14,5.00,11.00,0
management software for self storage,880,480,720,720,720,720,720,590,880,880,1000,1600,1300,171,23.97,6.91,31.86,42
self storage management software,880,480,720,720,720,720,720,590,880,880,1000,1600,1300,171,23.97,6.91,31.86,42
storage unit management software,880,480,720,720,720,720,720,590,880,880,1000,1600,1300,171,23.97,6.91,31.86,42
self storage manager,480,480,480,390,390,480,390,480,480,480,390,390,480,0,6.12,2.64,15.00,34
accounting software for self storage business,320,10,10,20,10,20,70,480,10,2900,320,10,140,1300,7.96,2.50,22.33,59
self hosted document management system,260,260,320,260,320,260,260,260,260,320,260,260,260,0,4.74,1.38,5.76,26
self storage company software,210,10,10,10,10,10,20,10,1000,1000,30,20,30,200,67.64,7.66,44.17,32
webselfstorage uhaul,210,260,210,170,210,170,170,170,170,170,210,320,320,23,2.44,2.37,8.00,3
self storage facility management software,170,140,110,90,140,110,110,90,390,320,90,110,210,50,16.21,4.53,23.78,22
self storage software companies,170,20,30,30,20,20,50,1000,260,70,170,90,70,250,14.42,7.91,29.75,35
self storage software cost,170,20,50,70,40,70,30,210,140,40,720,480,210,950,5.24,5.10,15.00,16
software for storage unit business,170,40,40,50,50,50,40,20,40,1300,170,20,110,175,15.03,8.80,22.56,64
storage facility management software,170,140,110,90,140,110,110,90,390,320,90,110,210,50,16.21,4.53,23.78,22
ez storage software,140,10,20,20,20,20,10,10,590,880,10,20,10,0,11.80,5.21,15.00,49
best self storage software,110,90,110,140,140,110,90,90,70,70,90,110,260,189,5.90,6.86,44.36,46
best storage unit software,110,90,110,140,140,110,90,90,70,70,90,110,260,189,5.90,6.86,44.36,46
software for self storage business,110,70,90,70,70,50,70,50,70,90,170,170,260,271,16.12,3.58,23.87,13
best self storage management software,70,40,50,90,90,40,70,30,40,90,110,70,140,250,15.71,7.16,35.82,27
mini storage management software,70,30,50,50,90,110,90,110,70,50,30,30,170,467,3.20,6.62,24.92,24
self storage point of sale software,70,10,90,40,140,140,110,140,90,40,10,10,110,1000,0.15,5.92,17.97,49
self storage pos software,70,10,90,40,140,140,110,140,90,40,10,10,110,1000,0.15,5.92,17.97,49
self storage software solutions,70,10,30,40,30,40,90,90,70,110,50,70,170,1600,1.26,13.31,46.15,10
self storage automation software,50,20,30,20,10,20,10,70,70,110,70,50,140,600,64.17,6.01,38.91,27
self storage crm,50,20,20,40,30,20,170,170,20,20,50,70,40,100,23.95,4.98,23.24,49
self storage property management software,50,40,40,30,40,50,40,40,30,40,30,70,170,325,4.65,7.28,24.63,30
self storage rental software,50,20,40,30,30,40,40,40,20,40,20,20,260,1200,13.79,10.34,52.61,42
self storage unit software,50,50,50,40,50,30,50,40,70,40,50,40,170,240,6.51,3.64,18.23,24
self storage website software,50,10,10,10,10,10,70,170,30,20,110,70,170,1600,8.08,6.43,18.70,33
sitelink self storage,50,40,70,50,50,70,50,50,90,30,70,50,50,25,11.85,3.08,15.00,46
sitelink storage software,50,40,50,40,50,50,50,30,30,70,50,40,40,0,22.67,5.52,24.58,41
storage rental software,50,50,50,40,50,30,50,40,70,40,50,40,170,240,6.51,3.64,18.23,24
storage unit rental software,50,20,40,30,30,40,40,40,20,40,20,20,260,1200,13.79,10.34,52.61,42
web based self storage software,50,10,30,20,50,70,70,70,40,20,10,10,260,2500,0.62,0.00,0.00,9
yardi self storage,50,40,70,70,70,50,90,50,50,40,70,50,40,0,10.55,5.48,19.76,33
cloud based self storage software,40,10,10,10,0,10,0,10,10,70,90,110,140,1300,0.09,0.00,0.00,0
easy storage software,40,40,40,40,40,40,30,40,50,40,50,50,30,-25,12.11,4.92,15.00,45
mini self storage software,40,10,30,20,50,70,70,70,50,30,10,10,10,0,15.62,6.19,12.17,18
mini storage rental software,40,10,30,20,50,70,70,70,50,30,10,10,10,0,15.62,6.19,12.17,18
self storage facility software,40,10,20,10,30,20,10,20,30,40,70,90,140,1300,16.99,8.75,38.85,31
self storage management system,40,10,40,40,50,70,50,70,30,40,20,30,40,300,4.61,1.50,20.25,18
self storage revenue management,40,30,40,30,40,50,40,20,30,50,40,40,110,267,2.33,4.77,29.05,29
software for self storage facilities,40,10,20,10,30,20,10,20,30,40,70,90,140,1300,16.99,8.75,38.85,31
easy storage solutions software,30,30,30,30,30,30,20,30,30,50,30,50,40,33,10.44,4.42,18.31,66
mini storage accounting software,30,10,20,10,20,10,10,10,10,10,10,70,140,1300,5.07,0.90,12.00,70
self storage accounting software,30,10,20,10,20,10,10,10,10,10,10,70,140,1300,5.07,0.90,12.00,70
self storage software programs,30,20,40,20,20,20,30,40,30,30,30,30,90,350,0.04,0.00,0.00,0
self storage unit management software,30,40,40,40,30,10,10,20,20,10,20,10,140,250,6.76,4.35,22.10,30
uhaul web self storage login,30,30,30,20,30,30,40,30,20,30,30,40,40,33,0.00,0.00,0.00,1
easy self storage software,20,10,20,10,10,10,10,10,10,10,10,10,90,800,5.56,5.79,46.37,45
online self storage software,20,10,20,10,30,30,30,40,30,20,10,10,10,0,14.21,0.00,0.00,5
public storage management software,20,10,20,10,50,40,20,30,20,20,10,10,0,-100,0.00,0.00,0.00,0
self storage software pricing,20,10,10,10,10,10,10,10,10,10,10,20,140,1300,0.04,0.00,0.00,7
software solution for mini storage,20,10,10,10,20,40,30,40,30,10,0,0,10,0,0.00,0.00,0.00,0
syrasoft connect,20,20,20,30,30,40,30,10,10,20,30,20,30,50,0.00,4.43,15.00,37
best mini storage software,10,10,10,10,10,10,10,10,10,10,10,10,10,0,25.70,0.00,0.00,23
best storage facility software,10,10,10,10,10,10,10,10,10,10,10,10,20,100,87.10,4.25,35.43,38
best storage unit management software,10,10,20,10,10,10,10,10,10,10,10,10,10,0,98.76,7.04,20.20,54
centershift self storage software,10,0,10,0,0,10,10,10,10,10,0,0,40,300,0.00,0.00,0.00,0
choosing self storage management software,10,10,0,10,10,10,10,10,0,10,0,10,10,0,0.00,0.00,0.00,0
cloud based self storage management software,10,10,10,10,10,10,10,10,10,10,10,10,10,0,0.00,0.00,0.00,0
cloud self storage software,10,10,10,10,10,10,0,10,10,10,10,10,10,0,0.00,0.00,0.00,0
management software for mini storage,10,10,10,10,20,30,20,30,20,10,10,10,10,0,0.00,0.00,0.00,0
management system for self storage,10,10,10,10,10,10,10,10,10,10,10,10,10,0,0.00,0.00,0.00,0
management system for storage business,10,0,10,0,0,0,0,10,0,10,10,10,0,-100,0.00,0.00,0.00,0
mini storage software programs,10,10,10,10,10,10,10,10,10,10,10,20,20,100,45.15,9.70,38.96,45
mini storage software solutions,10,0,10,10,10,10,10,10,10,0,10,10,10,0,0.00,0.00,0.00,0
mini warehouse software,10,10,10,10,10,0,10,0,0,10,0,10,10,0,0.00,0.00,0.00,100
quikstor gate control,10,10,10,10,10,10,10,10,0,10,10,10,10,0,0.00,0.00,0.00,0
self storage gate software,10,10,10,10,10,0,10,10,10,10,10,10,70,600,0.06,0.00,0.00,50
self storage management solutions,10,10,10,10,10,10,10,10,10,10,10,30,30,200,4.12,0.00,0.00,4
self storage management system software,10,0,0,0,0,0,10,0,0,0,0,0,90,800,0.37,0.00,0.00,0
self storage tracking software,10,10,10,10,10,10,10,10,10,10,10,10,10,0,0.00,0.00,0.00,8
sitelink self storage software,10,10,10,10,10,10,10,10,10,10,10,10,90,800,0.00,0.00,0.00,38
space manager self storage software,10,10,10,10,10,10,10,10,10,10,10,0,90,800,2.64,0.00,0.00,24
storage software for self storage,10,10,10,10,10,0,10,10,10,10,10,0,0,-100,0.00,0.00,0.00,0
storage unit business software,10,10,10,10,10,10,10,10,10,10,10,10,10,0,7.06,9.35,82.96,46
storage unit computer programs,10,10,10,20,10,10,10,10,10,10,10,10,10,0,0.00,1.50,8.60,37
storage unit software programs,10,10,10,10,10,10,10,10,10,10,10,0,10,0,0.00,0.00,0.00,0
syrasoft software,10,10,10,10,10,10,10,10,10,10,10,10,10,0,0.00,0.00,0.00,36
web self storage software,10,10,10,10,10,10,10,10,10,10,10,10,10,0,0.00,0.00,0.00,57
winsen self storage software,10,10,10,10,10,10,0,10,10,10,10,0,110,1000,0.14,0.00,0.00,50
yardi self storage software,10,10,10,10,10,10,10,10,10,10,10,10,70,600,8.83,6.83,16.30,61
webselfstorage mobile,0,0,0,0,0,0,0,0,0,0,0,0,0,0,0.00,0.00,0.00,0
